b'Save Farmer Save Nation #IndiaSupportsChakkaJaam #\xe0\xa4\x86\xe0\xa4\x9c_\xe0\xa4\xad\xe0\xa4\xbe\xe0\xa4\xb0\xe0\xa4\xa4_\xe0\xa4\xac\xe0\xa4\x82\xe0\xa4\xa6_\xe0\xa4\xb9 #\xe0\xa4\x86\xe0\xa4\x9c_\xe0\xa4\x9a\xe0\xa4\x95\xe0\xa5\x8d\xe0\xa4\x95\xe0\xa4\xbe_\xe0\xa4\x9c\xe0\xa4\xbe\xe0\xa4\xae_\xe0\xa4\xb0\xe0\xa4\xb9\xe0\xa5\x87\xe0\xa4\x97 https://t.co/OHM3Gj7SRG',b'RT Standing in solidarity with the #FarmersProtest in India Read about who they are and why they\xe2\x80\x99re protesting below http\xe2\x80\xa6',b'RT Rihanna was paid $2.5 milion by PR firm for farmer protest tweet https://t.co/pXSXZx72vM',b'RT Standing in solidarity with the #FarmersProtest in India Read about who they are and why they\xe2\x80\x99re protesting below http\xe2\x80\xa6',b'RT _com Pop star was paid over Rs.18 crores in dollars by PR firm with Khalistani links to tweet in support of farmer protests Re\xe2\x80\xa6',b'A big blow to the people who call themselves a farmer borrowing ideas from our great leader M.K.Stalin #ThankYouMKS',b'RT Youth organised motorcycle march from Kalajhar Toll (Sangrur Punjab to numerous countrysides for encouraging local i\xe2\x80\xa6',b'Modi govt has turned out to be a facist &amp dictator. more than 190 farmers killed &amp more than 500 Farmer missing. https://t.co/Wi5awsuMI5',b'RT _IND Rihanna Paid Khalistani Farmer Protest Icon Uses Blood Mica In Her \xe2\x80\x98Fenty Beauty Brand https://t.co/olomuc0hrc',b'RT Standing in solidarity with the #FarmersProtest in India Read about who they are and why they\xe2\x80\x99re protesting below http\xe2\x80\xa6'
b'RT Oh no Someone rips pappu in 20 seconds What is your take on this real Indian farmer Mr http\xe2\x80\xa6',b'RT Contract farming law enacted by Punjab government provides for 1 month jail and 5 lakh fine if the farmer reneges on his c\xe2\x80\xa6',"b'RT Dear &amp Family, Statement issued by GS I/c Organisation Shri ji: #Con\xe2\x80\xa6'",b'RT _IND Rihanna Paid Khalistani Farmer Protest Icon Uses Blood Mica In Her \xe2\x80\x98Fenty Beauty Brand https://t.co/olomuc0hrc',"b""You call yourself an environmentalist yet you don't know the stubble burning issue raised in the Ind https://t.co/BB4CJXDGJd""",b'RT Contract farming law enacted by Punjab government provides for 1 month jail and 5 lakh fine if the farmer reneges on his c\xe2\x80\xa6',b'RT Around one year back Sharjeel Imam was jailed for saying it and today its trending #ReleaseSharjeelImam #IndiaSupports\xe2\x80\xa6',b'RT \xe2\x80\x98There will be only one identity now one concern and one demand With nothing to divide the Great Divider will not be abl\xe2\x80\xa6',b'RT Around one year back Sharjeel Imam was jailed for saying it and today its trending #ReleaseSharjeelImam #IndiaSupports\xe2\x80\xa6',b'8 Laws require farmers to disclose PAN No of trader he is sells to. There lies the fix! Now trader isnt a farmer https://t.co/87BSxZznBs',b'RT Standing in solidarity with the #FarmersProtest in India Read about who they are and why they\xe2\x80\x99re protesting below http\xe2\x80\xa6',b'loans waivers free electricity minimum support price no income tax get support from international celebrities https://t.co/nkH1YLAe0s',b'No single farmer allowed Come in group.',b'RT Standing in solidarity with the #FarmersProtest in India Read about who they are and why they\xe2\x80\x99re protesting below http\xe2\x80\xa6',b'thnkss farmer for everything #\xe0\xa4\x86\xe0\xa4\x9c_\xe0\xa4\x9a\xe0\xa4\x95\xe0\xa5\x8d\xe0\xa4\x95\xe0\xa4\xbe_\xe0\xa4\x9c\xe0\xa4\xbe\xe0\xa4\xae_\xe0\xa4\xb0\xe0\xa4\xb9\xe0\xa5\x87\xe0\xa4\x97 https://t.co/2DCbFjk1KJ',b'RT Be nice to the farmers be NASTY to the Khalistanis Pl seperate the two and be ruthless to anyone who insults national f\xe2\x80\xa6',b'RT Badal Saab kal news reporter Rihanna dha puchreya si Afsana dha ney let\xe2\x80\x99s pray for our farmer brot\xe2\x80\xa6',"b""RT Makes sense I spoke on the Farmer's Protests quite late when I saw the free speech crackdown abd violence That's when I\xe2\x80\xa6""",b'RT _sen Two funerals involving the Indian national flag have got two very different reactions from the Uttar Pradesh Police https\xe2\x80\xa6',"b""RT For all Indians: Twitter is not getting banned from India It's fake news do not believe it Facts: India had asked T\xe2\x80\xa6""","b'RT ""3 days after the death of a 32-year-old UP farmer who had gone \xe2\x80\x9cmissing from the protest site at Ghazipur&amp;was later found\xe2\x80\xa6'",b'RT Standing in solidarity with the #FarmersProtest in India Read about who they are and why they\xe2\x80\x99re protesting below http\xe2\x80\xa6',b'RT Standing in solidarity with the #FarmersProtest in India Read about who they are and why they\xe2\x80\x99re protesting below http\xe2\x80\xa6',b'RT _IND Rihanna Paid Khalistani Farmer Protest Icon Uses Blood Mica In Her \xe2\x80\x98Fenty Beauty Brand https://t.co/olomuc0hrc',b'RT 1 month jail and 5 lakh fine if the farmer reneges on his commitment according to Punjab\xe2\x80\x99s Contract farming law. Congre\xe2\x80\xa6',b'RT Standing in solidarity with the #FarmersProtest in India Read about who they are and why they\xe2\x80\x99re protesting below http\xe2\x80\xa6',b'RT The specific page from the Punjab Contract Farming Act that punishes the farmer with Fine and/or jail What ji w\xe2\x80\xa6',b'RT Farmer Union Leaders have urged people to remain peaceful &amp the general public to kindly bear the inconvenience because\xe2\x80\xa6',b'RT Contract farming law enacted by Punjab government provides for 1 month jail and 5 lakh fine if the farmer reneges on his c\xe2\x80\xa6',"b""Riri support farmers bcz of human right I don't see any farmers pro https://t.co/rKdp8q4ING""",b'RT _IND Rihanna Paid Khalistani Farmer Protest Icon Uses Blood Mica In Her \xe2\x80\x98Fenty Beauty Brand https://t.co/olomuc0hrc',b'RT JUST IN Red-tagged peasant farmer Rommy Torres reported missing last February 3 in Norzagaray Bulacan was found dea\xe2\x80\xa6',b'RT Contract farming law enacted by Punjab government provides for 1 month jail and 5 lakh fine if the farmer reneges on his c\xe2\x80\xa6',b'RT Standing in solidarity with the #FarmersProtest in India Read about who they are and why they\xe2\x80\x99re protesting below http\xe2\x80\xa6',b'Quantum Mechanics Biden Coffee Squirrel Eyeliner Sun Cricket Farmer Protest CIA CAA LaTeX Minecraft Eminem Rape Cat https://t.co/HFSxWOjYx1',b'RT During his intervention today in the RS Minister revealed that in the Contract Farming Act of Punjab farmer/s c\xe2\x80\xa6',b'RT Also most of the Indian states have their #FarmLaws which are way to discriminatory For e\xe2\x80\xa6',b'RT Standing in solidarity with the #FarmersProtest in India Read about who they are and why they\xe2\x80\x99re protesting below http\xe2\x80\xa6',b'RT Contract farming law enacted by Punjab government provides for 1 month jail and 5 lakh fine if the farmer reneges on his c\xe2\x80\xa6',b'RT Contract farming law enacted by Punjab government provides for 1 month jail and 5 lakh fine if the farmer reneges on his c\xe2\x80\xa6',b'RT Contract farming law enacted by Punjab government provides for 1 month jail and 5 lakh fine if the farmer reneges on his c\xe2\x80\xa6',b'RT Contract farming law enacted by Punjab government provides for 1 month jail and 5 lakh fine if the farmer reneges on his c\xe2\x80\xa6',b'RT _Prakash Labor rights Did you ever bother to enquire how farmers treat the mostly Dalit agrarian labor Farmer panchayats in Pu\xe2\x80\xa6',b'RT _com It is time Meena Harris shuts up and stops supporting the violent insurrection in India Here is why https://t.co/ZOPoKIZB\xe2\x80\xa6',b'RT _com It is time Meena Harris shuts up and stops supporting the violent insurrection in India Here is why https://t.co/ZOPoKIZB\xe2\x80\xa6',b'RT Contract farming law enacted by Punjab government provides for 1 month jail and 5 lakh fine if the farmer reneges on his c\xe2\x80\xa6',b'RT _com Pop star was paid over Rs.18 crores in dollars by PR firm with Khalistani links to tweet in support of farmer protests Re\xe2\x80\xa6',b'RT 1 month jail and 5 lakh fine if the farmer reneges on his commitment according to Punjab\xe2\x80\x99s Contract farming law. Congre\xe2\x80\xa6',b'RT These guys legit saw 1000s of young Nigerians creating jobs for themselves in the remote/freelance economy without any h\xe2\x80\xa6',b'RT Save Farmer Save Nation #IndiaSupportsChakkaJaam #\xe0\xa4\x86\xe0\xa4\x9c_\xe0\xa4\xad\xe0\xa4\xbe\xe0\xa4\xb0\xe0\xa4\xa4_\xe0\xa4\xac\xe0\xa4\x82\xe0\xa4\xa6_\xe0\xa4\xb9 #\xe0\xa4\x86\xe0\xa4\x9c_\xe0\xa4\x9a\xe0\xa4\x95\xe0\xa5\x8d\xe0\xa4\x95\xe0\xa4\xbe_\xe0\xa4\x9c\xe0\xa4\xbe\xe0\xa4\xae_\xe0\xa4\xb0\xe0\xa4\xb9\xe0\xa5\x87\xe0\xa4\x97 http\xe2\x80\xa6'
b'RT Around one year back Sharjeel Imam was jailed for saying it and today its trending #ReleaseSharjeelImam #IndiaSupports\xe2\x80\xa6',b'RT The specific page from the Punjab Contract Farming Act that punishes the farmer with Fine and/or jail What ji w\xe2\x80\xa6',b'Could have been worse he could have butchered the farmer and his family.',b'RT Contract farming law enacted by Punjab government provides for 1 month jail and 5 lakh fine if the farmer reneges on his c\xe2\x80\xa6',b'RT Save Farmer Save Nation #IndiaSupportsChakkaJaam #\xe0\xa4\x86\xe0\xa4\x9c_\xe0\xa4\xad\xe0\xa4\xbe\xe0\xa4\xb0\xe0\xa4\xa4_\xe0\xa4\xac\xe0\xa4\x82\xe0\xa4\xa6_\xe0\xa4\xb9 #\xe0\xa4\x86\xe0\xa4\x9c_\xe0\xa4\x9a\xe0\xa4\x95\xe0\xa5\x8d\xe0\xa4\x95\xe0\xa4\xbe_\xe0\xa4\x9c\xe0\xa4\xbe\xe0\xa4\xae_\xe0\xa4\xb0\xe0\xa4\xb9\xe0\xa5\x87\xe0\xa4\x97 http\xe2\x80\xa6',b'RT Contract farming law enacted by Punjab government provides for 1 month jail and 5 lakh fine if the farmer reneges on his c\xe2\x80\xa6',"b'RT _Sharma Swedish farmers get a direct income support of Euro 12,590 per farmer which is double the average for EU farmers (in\xe2\x80\xa6'",b'I support farmer #IndiaSupportsChakkaJaam',"b'RT ""I am a farmer Govt takes 20 income as tax Wife at her mayke takes 25% Ghanta it\'s a crime to become a farmer. Says\xe2\x80\xa6'","b""Whether you are a farmer or a consumer this impacts you Stand Up Be Heard The little guy doesn't have to come l https://t.co/ZcMN7dOFhS"""
b'RT Nexus of Police GodiMedia and Hate Politics cant break the spirit of this Farmer Protest What next Repeal the Laws f\xe2\x80\xa6',b'RT Save Farmer Save Nation #IndiaSupportsChakkaJaam #\xe0\xa4\x86\xe0\xa4\x9c_\xe0\xa4\xad\xe0\xa4\xbe\xe0\xa4\xb0\xe0\xa4\xa4_\xe0\xa4\xac\xe0\xa4\x82\xe0\xa4\xa6_\xe0\xa4\xb9 #\xe0\xa4\x86\xe0\xa4\x9c_\xe0\xa4\x9a\xe0\xa4\x95\xe0\xa5\x8d\xe0\xa4\x95\xe0\xa4\xbe_\xe0\xa4\x9c\xe0\xa4\xbe\xe0\xa4\xae_\xe0\xa4\xb0\xe0\xa4\xb9\xe0\xa5\x87\xe0\xa4\x97 http\xe2\x80\xa6',b'RT Contract farming law enacted by Punjab government provides for 1 month jail and 5 lakh fine if the farmer reneges on his c\xe2\x80\xa6',b'RT Save Farmer Save Nation #IndiaSupportsChakkaJaam #\xe0\xa4\x86\xe0\xa4\x9c_\xe0\xa4\xad\xe0\xa4\xbe\xe0\xa4\xb0\xe0\xa4\xa4_\xe0\xa4\xac\xe0\xa4\x82\xe0\xa4\xa6_\xe0\xa4\xb9 #\xe0\xa4\x86\xe0\xa4\x9c_\xe0\xa4\x9a\xe0\xa4\x95\xe0\xa5\x8d\xe0\xa4\x95\xe0\xa4\xbe_\xe0\xa4\x9c\xe0\xa4\xbe\xe0\xa4\xae_\xe0\xa4\xb0\xe0\xa4\xb9\xe0\xa5\x87\xe0\xa4\x97 http\xe2\x80\xa6',b'RT Save Farmer Save Nation #IndiaSupportsChakkaJaam #\xe0\xa4\x86\xe0\xa4\x9c_\xe0\xa4\xad\xe0\xa4\xbe\xe0\xa4\xb0\xe0\xa4\xa4_\xe0\xa4\xac\xe0\xa4\x82\xe0\xa4\xa6_\xe0\xa4\xb9 #\xe0\xa4\x86\xe0\xa4\x9c_\xe0\xa4\x9a\xe0\xa4\x95\xe0\xa5\x8d\xe0\xa4\x95\xe0\xa4\xbe_\xe0\xa4\x9c\xe0\xa4\xbe\xe0\xa4\xae_\xe0\xa4\xb0\xe0\xa4\xb9\xe0\xa5\x87\xe0\xa4\x97 http\xe2\x80\xa6',b'RT According to this Madarsachhap A farmer supporting farm laws can not be a farmer because he is pro bjp leaders but com\xe2\x80\xa6',b'RT It is morning time Every trolley is being cleaned at the moment every farmer is living like his own house.but those\xe2\x80\xa6',b'RT _ The farmer who plowed the land for that time is more honorable than the one who took the bat for the country #FarmersP\xe2\x80\xa6',b'RT Contract farming law enacted by Punjab government provides for 1 month jail and 5 lakh fine if the farmer reneges on his c\xe2\x80\xa6',b'RT Standing in solidarity with the #FarmersProtest in India Read about who they are and why they\xe2\x80\x99re protesting below http\xe2\x80\xa6'
b'_bear ccording to this Madarsa educated A farmer supporting farm laws can not be a farmer because he is pro bj https://t.co/W3FDgYzKUQ',b'RT According to this Madarsachhap A farmer supporting farm laws can not be a farmer because he is pro bjp leaders but com\xe2\x80\xa6',b'I am Indian and as an Indian Farmer I am with our beloved Prime Minister Shri ji #\xe0\xa4\x9a\xe0\xa4\x95\xe0\xa5\x8d\xe0\xa4\x95\xe0\xa4\xbe_\xe0\xa4\x9c\xe0\xa4\xbe\xe0\xa4\xae_\xe0\xa4\xa8\xe0\xa4\xb9\xe0\xa5\x80\xe0\xa4\x82_\xe0\xa4\xb9\xe0\xa5\x8b\xe0\xa4\x97\xe0\xa4\xbe https://t.co/cJCVg3DGaS',"b""RT \xf0\x9f\x91\x89Birthday celebration at Tikri Border Farmer Mukesh turned 52 today \xf0\x9f\x91\x89He is a cancer patient \xf0\x9f\x91\x89He's part of #FarmersPr\xe2\x80\xa6""","b""RT Women of steel lead the way during the Farmer's protest. #FarmersProtest #IndiaSupportsChakkaJaam https://t.co/PeN4Wcwo0T""",b'RT Standing in solidarity with the #FarmersProtest in India Read about who they are and why they\xe2\x80\x99re protesting below http\xe2\x80\xa6',b'Anything is plausible',b'_rathee Comparing India with Sweden is a biggest blunder Yesterday also our Tamil Nadu govt has waived off a https://t.co/RYKTHU8WDI',b'RT No Farmer.. No Food.. No Future.. #KisaanmazdoorEktaZindabaad #farmersrprotest #supportfarmers https://t.co/CWAKYd2a\xe2\x80\xa6',b'#challengeaccepted We strongly back the disruptive innovations of #ciscoagrichallenge &amp nominate to https://t.co/38aVqc9Q33'
"b'Would you say something on farmer\xe2\x80\x99s protest in India,,,???'",b'RT Water &amp food supplies used to be blocked for Singhs in forests a farmer Bhai Taru Singh Ji defying all orders took water &amp;\xe2\x80\xa6',b'RT Save Farmer Save Nation #IndiaSupportsChakkaJaam #\xe0\xa4\x86\xe0\xa4\x9c_\xe0\xa4\xad\xe0\xa4\xbe\xe0\xa4\xb0\xe0\xa4\xa4_\xe0\xa4\xac\xe0\xa4\x82\xe0\xa4\xa6_\xe0\xa4\xb9 #\xe0\xa4\x86\xe0\xa4\x9c_\xe0\xa4\x9a\xe0\xa4\x95\xe0\xa5\x8d\xe0\xa4\x95\xe0\xa4\xbe_\xe0\xa4\x9c\xe0\xa4\xbe\xe0\xa4\xae_\xe0\xa4\xb0\xe0\xa4\xb9\xe0\xa5\x87\xe0\xa4\x97 http\xe2\x80\xa6',b'RT Oh no Someone rips pappu in 20 seconds What is your take on this real Indian farmer Mr http\xe2\x80\xa6',b'RT Contract farming law enacted by Punjab government provides for 1 month jail and 5 lakh fine if the farmer reneges on his c\xe2\x80\xa6',b'RT Standing in solidarity with the #FarmersProtest in India Read about who they are and why they\xe2\x80\x99re protesting below http\xe2\x80\xa6',b'RT According to this Madarsachhap A farmer supporting farm laws can not be a farmer because he is pro bjp leaders but com\xe2\x80\xa6',b'RT Standing in solidarity with the #FarmersProtest in India Read about who they are and why they\xe2\x80\x99re protesting below http\xe2\x80\xa6',b'RT Farmer #FarmersProstest https://t.co/mtBMtQbjWr',b'RT Save Farmer Save Nation #IndiaSupportsChakkaJaam #\xe0\xa4\x86\xe0\xa4\x9c_\xe0\xa4\xad\xe0\xa4\xbe\xe0\xa4\xb0\xe0\xa4\xa4_\xe0\xa4\xac\xe0\xa4\x82\xe0\xa4\xa6_\xe0\xa4\xb9 #\xe0\xa4\x86\xe0\xa4\x9c_\xe0\xa4\x9a\xe0\xa4\x95\xe0\xa5\x8d\xe0\xa4\x95\xe0\xa4\xbe_\xe0\xa4\x9c\xe0\xa4\xbe\xe0\xa4\xae_\xe0\xa4\xb0\xe0\xa4\xb9\xe0\xa5\x87\xe0\xa4\x97 http\xe2\x80\xa6',b'RT According to this Madarsachhap A farmer supporting farm laws can not be a farmer because he is pro bjp leaders but com\xe2\x80\xa6',b'RT According to this Madarsachhap A farmer supporting farm laws can not be a farmer because he is pro bjp leaders but com\xe2\x80\xa6',b'Many FARMERS R RICH REPEAL SUBSIDIES INSTEAD OF FARM LAW IMPOSE TAXES ON RICH FARMER SUPPORT POOR FARMER https://t.co/Dih0zumyY6',b'RT According to this Madarsachhap A farmer supporting farm laws can not be a farmer because he is pro bjp leaders but com\xe2\x80\xa6',b'RT Standing in solidarity with the #FarmersProtest in India Read about who they are and why they\xe2\x80\x99re protesting below http\xe2\x80\xa6',b'RT Contract farming law enacted by Punjab government provides for 1 month jail and 5 lakh fine if the farmer reneges on his c\xe2\x80\xa6',b'RT Standing in solidarity with the #FarmersProtest in India Read about who they are and why they\xe2\x80\x99re protesting below http\xe2\x80\xa6',"b'RT _mdz ""Mom I\'ve decided to quit my job and be a digital coin farmer gen z'",b'RT According to this Madarsachhap A farmer supporting farm laws can not be a farmer because he is pro bjp leaders but com\xe2\x80\xa6',b'Save Farmer Save Nation #IndiaSupportsChakkaJaam #\xe0\xa4\x86\xe0\xa4\x9c_\xe0\xa4\xad\xe0\xa4\xbe\xe0\xa4\xb0\xe0\xa4\xa4_\xe0\xa4\xac\xe0\xa4\x82\xe0\xa4\xa6_\xe0\xa4\xb9 #\xe0\xa4\x86\xe0\xa4\x9c_\xe0\xa4\x9a\xe0\xa4\x95\xe0\xa5\x8d\xe0\xa4\x95\xe0\xa4\xbe_\xe0\xa4\x9c\xe0\xa4\xbe\xe0\xa4\xae_\xe0\xa4\xb0\xe0\xa4\xb9\xe0\xa5\x87\xe0\xa4\x97\xe0\xa4\xbe',"b""RT \xf0\x9f\x91\x89Birthday celebration at Tikri Border Farmer Mukesh turned 52 today \xf0\x9f\x91\x89He is a cancer patient \xf0\x9f\x91\x89He's part of #FarmersPr\xe2\x80\xa6""",b'RT _1 This nationalist Sikh brother says those protesting against the farmers bill are miscreants playing dirty politics He ur\xe2\x80\xa6',b'RT _Saksena_ Who is the real farmer \xf0\x9f\x91\xa9\xe2\x80\x8d and who\xe2\x80\x99s crony capitalists https://t.co/o2Kx26dtvi',b'RT Save Farmer Save Nation #IndiaSupportsChakkaJaam #\xe0\xa4\x86\xe0\xa4\x9c_\xe0\xa4\xad\xe0\xa4\xbe\xe0\xa4\xb0\xe0\xa4\xa4_\xe0\xa4\xac\xe0\xa4\x82\xe0\xa4\xa6_\xe0\xa4\xb9 #\xe0\xa4\x86\xe0\xa4\x9c_\xe0\xa4\x9a\xe0\xa4\x95\xe0\xa5\x8d\xe0\xa4\x95\xe0\xa4\xbe_\xe0\xa4\x9c\xe0\xa4\xbe\xe0\xa4\xae_\xe0\xa4\xb0\xe0\xa4\xb9\xe0\xa5\x87\xe0\xa4\x97 http\xe2\x80\xa6',b'RT According to this Madarsachhap A farmer supporting farm laws can not be a farmer because he is pro bjp leaders but com\xe2\x80\xa6',b'RT According to this Madarsachhap A farmer supporting farm laws can not be a farmer because he is pro bjp leaders but com\xe2\x80\xa6',b'Rihanna Paid $2.5 million by PR Firm with Khalistani Links to Tweet in Support of Farmers Report Inconclusive pro https://t.co/1ua21eICsh',b'RT Wife brother of UP farmer who died in Delhi booked for \xe2\x80\x98insult to national flag https://t.co/Rsgxo07wZ0 via \xe2\x80\xa6',b'RT _doabia2 The protest was peaceful and will continue as long as the new farmer laws are not Repealed. #IndiaSupportsChakkaJaam #\xe2\x80\xa6',b'RT According to this Madarsachhap A farmer supporting farm laws can not be a farmer because he is pro bjp leaders but com\xe2\x80\xa6',b'Oh to be a vietnamese fish farmer in the jungle mountains',b'RT The specific page from the Punjab Contract Farming Act that punishes the farmer with Fine and/or jail What ji w\xe2\x80\xa6',b'Ya Laws that benefit farmers and farming itself not the laws which favor Ag https://t.co/uvM9bBJFb2',b'RT Standing in solidarity with the #FarmersProtest in India Read about who they are and why they\xe2\x80\x99re protesting below http\xe2\x80\xa6',"b""RT Women of steel lead the way during the Farmer's protest. #FarmersProtest #IndiaSupportsChakkaJaam https://t.co/PeN4Wcwo0T""",b'RT Contract farming law enacted by Punjab government provides for 1 month jail and 5 lakh fine if the farmer reneges on his c\xe2\x80\xa6',b'RT Save Farmer Save Nation #IndiaSupportsChakkaJaam #\xe0\xa4\x86\xe0\xa4\x9c_\xe0\xa4\xad\xe0\xa4\xbe\xe0\xa4\xb0\xe0\xa4\xa4_\xe0\xa4\xac\xe0\xa4\x82\xe0\xa4\xa6_\xe0\xa4\xb9 #\xe0\xa4\x86\xe0\xa4\x9c_\xe0\xa4\x9a\xe0\xa4\x95\xe0\xa5\x8d\xe0\xa4\x95\xe0\xa4\xbe_\xe0\xa4\x9c\xe0\xa4\xbe\xe0\xa4\xae_\xe0\xa4\xb0\xe0\xa4\xb9\xe0\xa5\x87\xe0\xa4\x97 #FarmersProtest #farmers\xe2\x80\xa6',"b""Salute to you for speaking truth Unless the honest of the world don't speak truth and support each ot https://t.co/it8dfHGMZF""",b'RT Contract farming law enacted by Punjab government provides for 1 month jail and 5 lakh fine if the farmer reneges on his c\xe2\x80\xa6',b'RT According to this Madarsachhap A farmer supporting farm laws can not be a farmer because he is pro bjp leaders but com\xe2\x80\xa6',b'RT The specific page from the Punjab Contract Farming Act that punishes the farmer with Fine and/or jail What ji w\xe2\x80\xa6',b'RT Contract farming law enacted by Punjab government provides for 1 month jail and 5 lakh fine if the farmer reneges on his c\xe2\x80\xa6',b'_bear ccording to this Madarsa educated A farmer supporting farm laws can not be a farmer because he is pro bj https://t.co/W3FDgYzKUQ',b'_Kuan _Sharma Girish you r right We must not combine tax savings tri https://t.co/rRE74MppyQ',b'RT According to this Madarsachhap A farmer supporting farm laws can not be a farmer because he is pro bjp leaders but com\xe2\x80\xa6',b'I am Indian and as an Indian Farmer I am with our beloved Prime Minister Shri ji #\xe0\xa4\x9a\xe0\xa4\x95\xe0\xa5\x8d\xe0\xa4\x95\xe0\xa4\xbe_\xe0\xa4\x9c\xe0\xa4\xbe\xe0\xa4\xae_\xe0\xa4\xa8\xe0\xa4\xb9\xe0\xa5\x80\xe0\xa4\x82_\xe0\xa4\xb9\xe0\xa5\x8b\xe0\xa4\x97\xe0\xa4\xbe https://t.co/cJCVg3DGaS',"b""RT \xf0\x9f\x91\x89Birthday celebration at Tikri Border Farmer Mukesh turned 52 today \xf0\x9f\x91\x89He is a cancer patient \xf0\x9f\x91\x89He's part of #FarmersPr\xe2\x80\xa6""","b""RT Women of steel lead the way during the Farmer's protest. #FarmersProtest #IndiaSupportsChakkaJaam https://t.co/PeN4Wcwo0T""",b'RT Standing in solidarity with the #FarmersProtest in India Read about who they are and why they\xe2\x80\x99re protesting below http\xe2\x80\xa6',b'Anything is plausible'
"b""RT Not done. UN interfering in internal affairs of India what we do to our farmer's is our internal family affair.\xf0\x9f\x98\x96 So ma\xe2\x80\xa6""",b'RT One nation one farmer \xf0\x9f\x99\x8f\xf0\x9f\x8f\xbd\xf0\x9f\x99\x8f\xf0\x9f\x8f\xbd\xf0\x9f\x99\x8f https://t.co/jhdGq6UaYa',b'RT Pappammal Ji an organic farmer from Thekkampatti village near Coimbatore won the Padma Shri in 2021. She is 105-year-old.\xe2\x80\xa6',b'RT Pappammal Ji an organic farmer from Thekkampatti village near Coimbatore won the Padma Shri in 2021. She is 105-year-old.\xe2\x80\xa6',b'RT Farmer of Nation MODI JI Retweet if you AGREE',b'RT _1 This nationalist Sikh brother says those protesting against the farmers bill are miscreants playing dirty politics He ur\xe2\x80\xa6',b'of radicalization. GOI is keen on resolution which is obvious till now But now it has upper hand in negotiati https://t.co/QwErDLKCxv',"b'RT I proud of you so much ,you support indian farmers Thanks alot standing in fa\xe2\x80\xa6'","b'RT ""3 days after the death of a 32-year-old UP farmer who had gone \xe2\x80\x9cmissing from the protest site at Ghazipur&amp;was later found\xe2\x80\xa6'",b'RT Pappammal Ji an organic farmer from Thekkampatti village near Coimbatore won the Padma Shri in 2021. She is 105-year-old.\xe2\x80\xa6'
